{
  "slug": "project-discovery",
  "kind": "pipeline",
  "title": "Project Discovery",
  "summary": "Discovery > Scaffolding > Planning > Build\n\nThis is the Discovery phase. Lock a local-first stack into SpecX Decision Matrix and Architecture Rules from the project requirements SpecX.\n\nAgent instruction: Run Project Discovery for `Your Project Name`",
  "tags": [
    "domain.engineering",
    "use-case.discovery"
  ],
  "collection": "builder",
  "createdAt": "2026-08-03",
  "updatedAt": "2026-08-04",
  "sourceVersion": "1.0",
  "schemaVersion": "1",
  "authors": [
    "Spec DB"
  ],
  "license": "CC-BY-4.0",
  "featured": true,
  "relatedSlugs": [
    "architecture-decision-matrix",
    "discovery-rules",
    "pipeline-operating-contract",
    "project-scaffolding"
  ]
}
