{
  "slug": "agile-sdlc-artifact-routing-guide",
  "kind": "spec",
  "title": "Agile Artifact Routing Guide",
  "summary": "Sole authority for choosing lean Agile SDLC artifacts and organizing runtime work outside protected imported collections.",
  "tags": [
    "agile-sdlc",
    "domain.product",
    "use-case.planning"
  ],
  "collection": "agile-sdlc",
  "createdAt": "2026-09-29",
  "updatedAt": "2026-10-02",
  "sourceVersion": "1.0",
  "schemaVersion": "1",
  "license": "CC-BY-4.0",
  "relatedSlugs": [
    "agile-sdlc-generate-product-spec"
  ]
}
