{
  "slug": "app-builder-nodejs-api-contract",
  "kind": "spec",
  "title": "App Builder Node.js API Contract",
  "summary": "Tree, pins, and checks for the Node.js API starter.",
  "tags": ["app-builder", "domain.engineering", "use-case.execution"],
  "collection": "app-builder",
  "createdAt": "2026-09-30",
  "updatedAt": "2026-09-30",
  "sourceVersion": "1.0",
  "schemaVersion": "1",
  "license": "CC-BY-4.0",
  "relatedSlugs": [
    "app-builder-api-standards"
  ]
}
