{
  "slug": "app-builder-web-standards",
  "kind": "spec",
  "title": "App Builder Web Standards",
  "summary": "Architectural standards for Next.js and React + Vite web applications.",
  "tags": [
    "app-builder",
    "domain.engineering",
    "use-case.execution"
  ],
  "collection": "app-builder",
  "subcollection": "app-builder-standards",
  "createdAt": "2026-09-30",
  "updatedAt": "2026-10-02",
  "sourceVersion": "1.0",
  "schemaVersion": "1",
  "license": "CC-BY-4.0"
}
