{
  "slug": "ai-sdlc-feature-spec-builder",
  "kind": "pipeline",
  "title": "Change Request Builder",
  "summary": "Turn a bounded amendment and its source contract into a Change Request: impact, acceptance criteria, and whether to implement directly or plan design first. Continue here when an existing contract is being amended. Launch with empty inputs to discover existing documents.",
  "tags": [
    "ai-sdlc",
    "domain.product",
    "use-case.specification"
  ],
  "collection": "ai-sdlc",
  "createdAt": "2026-09-08",
  "updatedAt": "2026-09-15",
  "sourceVersion": "1.2",
  "schemaVersion": "1",
  "authors": [
    "Spec DB"
  ],
  "license": "CC-BY-4.0",
  "relatedSlugs": [
    "ai-sdlc-design-feature-to-milestone-plan",
    "ai-sdlc-feature-spec-template",
    "ai-sdlc-prd-feature-to-design-spec",
    "ai-sdlc-prd-vs-feature-spec-guidelines"
  ]
}
